Sheet: gdp
C1: 1973 | D1: 1974 | E1: 1975 | F1: 1976 | G1: 1977 | H1: 1978 | I1: 1979 | J1: 1980 | K1: 1981 | L1: 1982 | M1: 1983 | N1: 1984 | O1: 1985 | P1: 1986 | Q1: 1987 | R1: 1988 | S1: 1989 | T1: 1990 | U1: 1991 | V1: 1992 | W1: 1993 | X1: 1994 | Y1: 1995 | Z1: 1996 | AA1: 1997 | AB1: 1998 | AC1: 1999 | AD1: 2000 | AE1: 2001 | AF1: 2002 | AG1: 2003 | AH1: 2004 | AI1: 2005 | AJ1: 2006 | AK1: 2007 | AL1: 2008 | AM1: 2009 | AN1: 2010 | AO1: 2011 | AP1: 2012 | AQ1: 2013 | AR1: 2014 | AS1: 2015 | AT1: 2016
A2: Afghanistan | B2: of:=SUM([.C2:.AT2]) -> 3.31754 | AS2: 3.31754
A3: Albania | B3: of:=SUM([.C3:.AT3]) -> 3.53944 | AQ3: 3.53944
A4: Algeria | B4: of:=SUM([.C4:.AT4]) -> 4.35425 | AL4: 4.35425
A5: Andorra | B5: of:=SUM([.C5:.AT5]) -> 3.25368 | AS5: 3.25368
A6: Angola | B6: of:=SUM([.C6:.AT6]) -> 3.47623 | AN6: 3.47623
A7: Anguilla | B7: of:=SUM([.C7:.AT7]) -> 2.84263 | AL7: 2.84263
A8: Antigua and Barbuda | B8: of:=SUM([.C8:.AT8]) -> 2.55447 | AM8: 2.55447
A9: Argentina | B9: of:=SUM([.C9:.AT9]) -> 5.32549 | AR9: 5.32549
A10: Armenia | B10: of:=SUM([.C10:.AT10]) -> 2.81351 | AS10: 2.81351
A11: Aruba | B11: of:=SUM([.C11:.AT11]) -> 6.16293 | AR11: 6.16293
A12: Australia | B12: of:=SUM([.C12:.AT12]) -> 5.22534 | AR12: 5.22534
A13: Austria | B13: of:=SUM([.C13:.AT13]) -> 5.49955 | AR13: 5.49955
A14: Azerbaijan | B14: of:=SUM([.C14:.AT14]) -> 2.63466 | AR14: 2.63466
A15: Bahamas | B15: of:=SUM([.C15:.AT15]) -> 2.84999 | AD15: 2.84999
A16: Bahrain | B16: of:=SUM([.C16:.AT16]) -> 2.66808 | AS16: 2.66808
A17: Bangladesh | B17: of:=SUM([.C17:.AT17]) -> 1.92634 | AT17: 1.92634
A18: Barbados | B18: of:=SUM([.C18:.AT18]) -> 6.5733 | AR18: 6.5733
A19: Belarus | B19: of:=SUM([.C19:.AT19]) -> 4.94765 | AS19: 4.94765
A20: Belgium | B20: of:=SUM([.C20:.AT20]) -> 6.58514 | AR20: 6.58514
A21: Belize | B21: of:=SUM([.C21:.AT21]) -> 6.42584 | AR21: 6.42584
A22: Benin | B22: of:=SUM([.C22:.AT22]) -> 4.35981 | AS22: 4.35981
A23: Bermuda | B23: of:=SUM([.C23:.AT23]) -> 1.7043 | AS23: 1.7043
A24: Bhutan | B24: of:=SUM([.C24:.AT24]) -> 7.36169 | AS24: 7.36169
A25: Bolivia (Plurinational State of) | B25: of:=SUM([.C25:.AT25]) -> 7.28546 | AR25: 7.28546
A26: Botswana | B26: of:=SUM([.C26:.AT26]) -> 9.63292 | AM26: 9.63292
A27: Brazil | B27: of:=SUM([.C27:.AT27]) -> 5.99395 | AQ27: 5.99395
A28: British Virgin Islands | B28: of:=SUM([.C28:.AT28]) -> 6.64192 | AS28: 6.64192
A29: Brunei Darussalam | B29: of:=SUM([.C29:.AT29]) -> 4.42541 | AT29: 4.42541
A30: Bulgaria | B30: of:=SUM([.C30:.AT30]) -> 4.06197 | AQ30: 4.06197
A31: Burkina Faso | B31: of:=SUM([.C31:.AT31]) -> 4.06224 | AS31: 4.06224
A32: Burundi | B32: of:=SUM([.C32:.AT32]) -> 5.41642 | AQ32: 5.41642
A33: Cabo Verde | B33: of:=SUM([.C33:.AT33]) -> 4.99245 | AQ33: 4.99245
A34: Cambodia | B34: of:=SUM([.C34:.AT34]) -> 1.90197 | AR34: 1.90197
A35: Cameroon | B35: of:=SUM([.C35:.AT35]) -> 3.0299 | AQ35: 3.0299
A36: Canada | B36: of:=SUM([.C36:.AT36]) -> 5.28122 | AO36: 5.28122
A37: Central African Republic | B37: of:=SUM([.C37:.AT37]) -> 1.22393 | AO37: 1.22393
A38: Chad | B38: of:=SUM([.C38:.AT38]) -> 2.84971 | AQ38: 2.84971
A39: Chile | B39: of:=SUM([.C39:.AT39]) -> 4.92324 | AS39: 4.92324
A40: China | B40: of:=SUM([.C40:.AT40]) -> 1.8873 | AC40: 1.8873
A41: China, Hong Kong Special Administrative Region | B41: of:=SUM([.C41:.AT41]) -> 3.26212 | AS41: 3.26212
A42: China, Macao Special Administrative Region | B42: of:=SUM([.C42:.AT42]) -> 2.02779 | AR42: 2.02779
A43: Colombia | B43: of:=SUM([.C43:.AT43]) -> 4.49099 | AS43: 4.49099
A44: Comoros | B44: of:=SUM([.C44:.AT44]) -> 4.34329 | AS44: 4.34329
A45: Congo | B45: of:=SUM([.C45:.AT45]) -> 6.21789 | AN45: 6.21789
A46: Cook Islands | B46: of:=SUM([.C46:.AT46]) -> 3.87887 | AS46: 3.87887
A47: Costa Rica | B47: of:=SUM([.C47:.AT47]) -> 7.17601 | AS47: 7.17601
A48: Côte d'Ivoire | B48: of:=SUM([.C48:.AT48]) -> 5.03422 | AS48: 5.03422
A49: Croatia | B49: of:=SUM([.C49:.AT49]) -> 4.5816 | AQ49: 4.5816
A50: Cuba | B50: of:=SUM([.C50:.AT50]) -> 12.83727 | AN50: 12.83727
A51: Curaçao | B51: of:=SUM([.C51:.AT51]) -> 4.93095 | AQ51: 4.93095
A52: Cyprus | B52: of:=SUM([.C52:.AT52]) -> 6.13839 | AR52: 6.13839
A53: Czechia | B53: of:=SUM([.C53:.AT53]) -> 4.08902 | AQ53: 4.08902
A54: Democratic Republic of the Congo | B54: of:=SUM([.C54:.AT54]) -> 2.24535 | AQ54: 2.24535
A55: Denmark | B55: of:=SUM([.C55:.AT55]) -> 8.62711 | AQ55: 8.62711
A56: Djibouti | B56: of:=SUM([.C56:.AT56]) -> 4.48079 | AN56: 4.48079
A57: Dominica | B57: of:=SUM([.C57:.AT57]) -> 4.99184 | AC57: 4.99184
A58: Dominican Republic | B58: of:=SUM([.C58:.AT58]) -> 2.04457 | AK58: 2.04457
A59: Ecuador | B59: of:=SUM([.C59:.AT59]) -> 4.96322 | AS59: 4.96322
A60: Egypt | B60: of:=SUM([.C60:.AT60]) -> 3.75873 | AL60: 3.75873
A61: El Salvador | B61: of:=SUM([.C61:.AT61]) -> 3.54506 | AS61: 3.54506
A62: Equatorial Guinea | B62: of:=SUM([.C62:.AT62]) -> 2.18486 | AB62: 2.18486
A63: Eritrea | B63: of:=SUM([.C63:.AT63]) -> 2.127 | AJ63: 2.127
A64: Estonia | B64: of:=SUM([.C64:.AT64]) -> 5.48164 | AR64: 5.48164
A65: Ethiopia | B65: of:=SUM([.C65:.AT65]) -> 4.50051 | AQ65: 4.50051
A66: Fiji | B66: of:=SUM([.C66:.AT66]) -> 3.88289 | AQ66: 3.88289
A67: Finland | B67: of:=SUM([.C67:.AT67]) -> 7.1681 | AR67: 7.1681
A68: France | B68: of:=SUM([.C68:.AT68]) -> 5.49299 | AQ68: 5.49299
A69: Gabon | B69: of:=SUM([.C69:.AT69]) -> 2.66617 | AR69: 2.66617
A70: Gambia | B70: of:=SUM([.C70:.AT70]) -> 2.76771 | AQ70: 2.76771
A71: Georgia | B71: of:=SUM([.C71:.AT71]) -> 1.98331 | AP71: 1.98331
A72: Germany | B72: of:=SUM([.C72:.AT72]) -> 4.95219 | AR72: 4.95219
A73: Ghana | B73: of:=SUM([.C73:.AT73]) -> 6.17855 | AR73: 6.17855
A74: Greece | B74: of:=SUM([.C74:.AT74]) -> 3.96878 | AI74: 3.96878
A75: Grenada | B75: of:=SUM([.C75:.AT75]) -> 3.92674 | AG75: 3.92674
A76: Guatemala | B76: of:=SUM([.C76:.AT76]) -> 2.95595 | AS76: 2.95595
A77: Guinea | B77: of:=SUM([.C77:.AT77]) -> 3.20817 | AR77: 3.20817
A78: Guinea-Bissau | B78: of:=SUM([.C78:.AT78]) -> 2.17313 | AQ78: 2.17313
A79: Guyana | B79: of:=SUM([.C79:.AT79]) -> 3.19216 | AP79: 3.19216
A80: Haiti | B80: of:=SUM([.C80:.AT80]) -> 1.07399 | U80: 1.07399
A81: Honduras | B81: of:=SUM([.C81:.AT81]) -> 5.86775 | AQ81: 5.86775
A82: Hungary | B82: of:=SUM([.C82:.AT82]) -> 4.65935 | AR82: 4.65935
A83: Iceland | B83: of:=SUM([.C83:.AT83]) -> 7.80585 | AQ83: 7.80585
A84: India | B84: of:=SUM([.C84:.AT84]) -> 3.84236 | AQ84: 3.84236
A85: Indonesia | B85: of:=SUM([.C85:.AT85]) -> 3.59181 | AS85: 3.59181
A86: Iran (Islamic Republic of) | B86: of:=SUM([.C86:.AT86]) -> 2.92899 | AS86: 2.92899
A87: Iraq | B87: of:=SUM([.C87:.AT87]) -> 3.5515 | S87: 3.5515
A88: Ireland | B88: of:=SUM([.C88:.AT88]) -> 5.32457 | AQ88: 5.32457
A89: Israel | B89: of:=SUM([.C89:.AT89]) -> 5.75727 | AR89: 5.75727
A90: Italy | B90: of:=SUM([.C90:.AT90]) -> 4.07985 | AR90: 4.07985
A91: Jamaica | B91: of:=SUM([.C91:.AT91]) -> 5.46196 | AS91: 5.46196
A92: Japan | B92: of:=SUM([.C92:.AT92]) -> 3.59184 | AR92: 3.59184
A93: Jordan | B93: of:=SUM([.C93:.AT93]) -> 4.94514 | AC93: 4.94514
A94: Kazakhstan | B94: of:=SUM([.C94:.AT94]) -> 2.7875 | AS94: 2.7875
A95: Kenya | B95: of:=SUM([.C95:.AT95]) -> 5.27392 | AS95: 5.27392
A96: Kiribati | B96: of:=SUM([.C96:.AT96]) -> 11.98812 | AE96: 11.98812
A97: Kuwait | B97: of:=SUM([.C97:.AT97]) -> 3.76001 | AJ97: 3.76001
A98: Kyrgyzstan | B98: of:=SUM([.C98:.AT98]) -> 5.52738 | AR98: 5.52738
A99: Lao People's Democratic Republic | B99: of:=SUM([.C99:.AT99]) -> 3.32011 | AR99: 3.32011
A100: Latvia | B100: of:=SUM([.C100:.AT100]) -> 5.28524 | AR100: 5.28524
A101: Lebanon | B101: of:=SUM([.C101:.AT101]) -> 2.57119 | AQ101: 2.57119
A102: Lesotho | B102: of:=SUM([.C102:.AT102]) -> 11.36114 | AL102: 11.36114
A103: Liberia | B103: of:=SUM([.C103:.AT103]) -> 2.75756 | AP103: 2.75756
A104: Libya | B104: of:=SUM([.C104:.AT104]) -> 2.26417 | AC104: 2.26417
A105: Liechtenstein | B105: of:=SUM([.C105:.AT105]) -> 2.55604 | AO105: 2.55604
A106: Lithuania | B106: of:=SUM([.C106:.AT106]) -> 4.6125 | AQ106: 4.6125
A107: Luxembourg | B107: of:=SUM([.C107:.AT107]) -> 4.08388 | AR107: 4.08388
A108: Madagascar | B108: of:=SUM([.C108:.AT108]) -> 2.08204 | AQ108: 2.08204
A109: Malawi | B109: of:=SUM([.C109:.AT109]) -> 5.60799 | AS109: 5.60799
A110: Malaysia | B110: of:=SUM([.C110:.AT110]) -> 4.96636 | AS110: 4.96636
A111: Maldives | B111: of:=SUM([.C111:.AT111]) -> 5.22351 | AS111: 5.22351
A112: Mali | B112: of:=SUM([.C112:.AT112]) -> 3.73929 | AR112: 3.73929
A113: Malta | B113: of:=SUM([.C113:.AT113]) -> 7.849 | AQ113: 7.849
A114: Marshall Islands | B114: of:=SUM([.C114:.AT114]) -> 12.23999 | AG114: 12.23999
A115: Mauritania | B115: of:=SUM([.C115:.AT115]) -> 2.93012 | AQ115: 2.93012
A116: Mauritius | B116: of:=SUM([.C116:.AT116]) -> 4.88539 | AS116: 4.88539
A117: Mexico | B117: of:=SUM([.C117:.AT117]) -> 5.31348 | AR117: 5.31348
A118: Micronesia (Federated States of) | B118: of:=SUM([.C118:.AT118]) -> 12.46775 | AS118: 12.46775
A119: Monaco | B119: of:=SUM([.C119:.AT119]) -> 1.02195 | AR119: 1.02195
A120: Mongolia | B120: of:=SUM([.C120:.AT120]) -> 4.59987 | AO120: 4.59987
A121: Montserrat | B121: of:=SUM([.C121:.AT121]) -> 5.12753 | AM121: 5.12753
A122: Morocco | B122: of:=SUM([.C122:.AT122]) -> 5.26404 | AM122: 5.26404
A123: Mozambique | B123: of:=SUM([.C123:.AT123]) -> 6.48322 | AQ123: 6.48322
A124: Myanmar | B124: of:=SUM([.C124:.AT124]) -> 1.2019 | Y124: 1.2019
A125: Namibia | B125: of:=SUM([.C125:.AT125]) -> 8.34961 | AN125: 8.34961
A126: Nepal | B126: of:=SUM([.C126:.AT126]) -> 3.71216 | AS126: 3.71216
A127: Netherlands | B127: of:=SUM([.C127:.AT127]) -> 5.52938 | AR127: 5.52938
A128: New Zealand | B128: of:=SUM([.C128:.AT128]) -> 6.36889 | AS128: 6.36889
A129: Nicaragua | B129: of:=SUM([.C129:.AT129]) -> 4.48549 | AN129: 4.48549
A130: Niger | B130: of:=SUM([.C130:.AT130]) -> 6.70941 | AR130: 6.70941
A131: Nigeria | B131: of:=SUM([.C131:.AT131]) -> 3.06369 | E131: 3.06369
A132: Norway | B132: of:=SUM([.C132:.AT132]) -> 7.37329 | AQ132: 7.37329
A133: Oman | B133: of:=SUM([.C133:.AT133]) -> 4.96038 | AQ133: 4.96038
A134: Pakistan | B134: of:=SUM([.C134:.AT134]) -> 2.64674 | AS134: 2.64674
A135: Palau | B135: of:=SUM([.C135:.AT135]) -> 7.50749 | AF135: 7.50749
A136: Palestine | B136: of:=SUM([.C136:.AT136]) -> 1.32232 | AS136: 1.32232
A137: Panama | B137: of:=SUM([.C137:.AT137]) -> 3.18772 | AO137: 3.18772
A138: Papua New Guinea | B138: of:=SUM([.C138:.AT138]) -> 7.38971 | G138: 7.38971
A139: Paraguay | B139: of:=SUM([.C139:.AT139]) -> 4.9554 | AP139: 4.9554
A140: Peru | B140: of:=SUM([.C140:.AT140]) -> 3.97865 | AS140: 3.97865
A141: Philippines | B141: of:=SUM([.C141:.AT141]) -> 2.65168 | AM141: 2.65168
A142: Poland | B142: of:=SUM([.C142:.AT142]) -> 4.91175 | AR142: 4.91175
A143: Portugal | B143: of:=SUM([.C143:.AT143]) -> 5.12559 | AR143: 5.12559
A144: Puerto Rico | B144: of:=SUM([.C144:.AT144]) -> 6.39077 | AQ144: 6.39077
A145: Qatar | B145: of:=SUM([.C145:.AT145]) -> 3.60719 | AR145: 3.60719
A146: Republic of Korea | B146: of:=SUM([.C146:.AT146]) -> 5.05211 | AS146: 5.05211
A147: Republic of Moldova | B147: of:=SUM([.C147:.AT147]) -> 7.46784 | AR147: 7.46784
A148: Romania | B148: of:=SUM([.C148:.AT148]) -> 3.12918 | AR148: 3.12918
A149: Russian Federation | B149: of:=SUM([.C149:.AT149]) -> 3.86133 | AP149: 3.86133
A150: Rwanda | B150: of:=SUM([.C150:.AT150]) -> 3.61734 | AT150: 3.61734
A151: Saint Kitts and Nevis | B151: of:=SUM([.C151:.AT151]) -> 2.78424 | AS151: 2.78424
A152: Saint Lucia | B152: of:=SUM([.C152:.AT152]) -> 4.89715 | AS152: 4.89715
A153: Saint Vincent and the Grenadines | B153: of:=SUM([.C153:.AT153]) -> 5.08523 | AN153: 5.08523
A154: Samoa | B154: of:=SUM([.C154:.AT154]) -> 5.14421 | AL154: 5.14421
A155: San Marino | B155: of:=SUM([.C155:.AT155]) -> 2.38373 | AO155: 2.38373
A156: Sao Tome and Principe | B156: of:=SUM([.C156:.AT156]) -> 3.75682 | AR156: 3.75682
A157: Saudi Arabia | B157: of:=SUM([.C157:.AT157]) -> 5.13581 | AL157: 5.13581
A158: Senegal | B158: of:=SUM([.C158:.AT158]) -> 7.3962 | AR158: 7.3962
A159: Serbia | B159: of:=SUM([.C159:.AT159]) -> 4.17861 | AR159: 4.17861
A160: Seychelles | B160: of:=SUM([.C160:.AT160]) -> 3.60644 | AO160: 3.60644
A161: Sierra Leone | B161: of:=SUM([.C161:.AT161]) -> 2.66167 | AR161: 2.66167
A162: Singapore | B162: of:=SUM([.C162:.AT162]) -> 2.91579 | AQ162: 2.91579
A163: Slovakia | B163: of:=SUM([.C163:.AT163]) -> 4.23856 | AR163: 4.23856
A164: Slovenia | B164: of:=SUM([.C164:.AT164]) -> 5.48659 | AQ164: 5.48659
A165: Solomon Islands | B165: of:=SUM([.C165:.AT165]) -> 10.00108 | AN165: 10.00108
A166: Somalia | B166: of:=SUM([.C166:.AT166]) -> 1.27728 | C166: 1.27728
A167: South Africa | B167: of:=SUM([.C167:.AT167]) -> 6.02955 | AR167: 6.02955
A168: South Sudan | B168: of:=SUM([.C168:.AT168]) -> 1.81094 | AT168: 1.81094
A169: Spain | B169: of:=SUM([.C169:.AT169]) -> 4.27093 | AR169: 4.27093
A170: Sri Lanka | B170: of:=SUM([.C170:.AT170]) -> 2.17912 | AS170: 2.17912
A171: Sudan | B171: of:=SUM([.C171:.AT171]) -> 2.22459 | AM171: 2.22459
A172: Swaziland | B172: of:=SUM([.C172:.AT172]) -> 7.04999 | AR172: 7.04999
A173: Sweden | B173: of:=SUM([.C173:.AT173]) -> 7.67509 | AR173: 7.67509
A174: Switzerland | B174: of:=SUM([.C174:.AT174]) -> 5.09608 | AR174: 5.09608
A175: Syrian Arab Republic | B175: of:=SUM([.C175:.AT175]) -> 5.13014 | AM175: 5.13014
A176: Tajikistan | B176: of:=SUM([.C176:.AT176]) -> 5.23215 | AS176: 5.23215
A177: Thailand | B177: of:=SUM([.C177:.AT177]) -> 4.12887 | AQ177: 4.12887
A178: The former Yugoslav Republic of Macedonia | B178: of:=SUM([.C178:.AT178]) -> 3.29481 | AF178: 3.29481
A179: Timor-Leste | B179: of:=SUM([.C179:.AT179]) -> 7.775 | AR179: 7.775
A180: Togo | B180: of:=SUM([.C180:.AT180]) -> 5.2179 | AS180: 5.2179
A181: Tonga | B181: of:=SUM([.C181:.AT181]) -> 3.90804 | AH181: 3.90804
A182: Trinidad and Tobago | B182: of:=SUM([.C182:.AT182]) -> 3.1366 | AG182: 3.1366
A183: Tunisia | B183: of:=SUM([.C183:.AT183]) -> 6.25036 | AP183: 6.25036
A184: Turkey | B184: of:=SUM([.C184:.AT184]) -> 4.76626 | AQ184: 4.76626
A185: Turkmenistan | B185: of:=SUM([.C185:.AT185]) -> 3.0559 | AP185: 3.0559
A186: Turks and Caicos Islands | B186: of:=SUM([.C186:.AT186]) -> 3.26528 | AS186: 3.26528
A187: Tuvalu | B187: of:=SUM([.C187:.AT187]) -> 3730833.50864 | AA187: 3730833.50864
A188: Uganda | B188: of:=SUM([.C188:.AT188]) -> 2.21387 | AR188: 2.21387
A189: Ukraine | B189: of:=SUM([.C189:.AT189]) -> 5.86354 | AR189: 5.86354
A190: United Arab Emirates | B190: of:=SUM([.C190:.AT190]) -> 1.11104 | AA190: 1.11104
A191: United Kingdom of Great Britain and Northern Ireland | B191: of:=SUM([.C191:.AT191]) -> 5.68427 | AS191: 5.68427
A192: United Republic of Tanzania | B192: of:=SUM([.C192:.AT192]) -> 3.47914 | AR192: 3.47914
A193: United States of America | B193: of:=SUM([.C193:.AT193]) -> 5.38078 | AR193: 5.38078
A194: Uruguay | B194: of:=SUM([.C194:.AT194]) -> 4.35694 | AO194: 4.35694
A195: Vanuatu | B195: of:=SUM([.C195:.AT195]) -> 5.54987 | AS195: 5.54987
A196: Venezuela (Bolivarian Republic of) | B196: of:=SUM([.C196:.AT196]) -> 6.87723 | AM196: 6.87723
A197: Viet Nam | B197: of:=SUM([.C197:.AT197]) -> 5.65873 | AQ197: 5.65873
A198: Yemen | B198: of:=SUM([.C198:.AT198]) -> 5.14743 | AL198: 5.14743
A199: Zambia | B199: of:=SUM([.C199:.AT199]) -> 1.09972 | AL199: 1.09972
A200: Zimbabwe | B200: of:=SUM([.C200:.AT200]) -> 8.42933 | AR200: 8.42933

Sheet: lit
C1: 1970 | D1: 1971 | E1: 1972 | F1: 1973 | G1: 1974 | H1: 1975 | I1: 1976 | J1: 1977 | K1: 1978 | L1: 1979 | M1: 1980 | N1: 1981 | O1: 1982 | P1: 1983 | Q1: 1984 | R1: 1985 | S1: 1986 | T1: 1987 | U1: 1988 | V1: 1989 | W1: 1990 | X1: 1991 | Y1: 1992 | Z1: 1993 | AA1: 1994 | AB1: 1995 | AC1: 1996 | AD1: 1997 | AE1: 1998 | AF1: 1999 | AG1: 2000 | AH1: 2001 | AI1: 2002 | AJ1: 2003 | AK1: 2004 | AL1: 2005 | AM1: 2006 | AN1: 2007 | AO1: 2008 | AP1: 2009 | AQ1: 2010 | AR1: 2011 | AS1: 2012 | AT1: 2013 | AU1: 2014 | AV1: 2015 | AW1: 2016
A2: Afghanistan | B2: of:=SUM([.C2:.AW2]) -> 31.74112 | AR2: 31.74112
A3: Albania | B3: of:=SUM([.C3:.AW3]) -> 97.24697 | AS3: 97.24697
A4: Algeria | B4: of:=SUM([.C4:.AW4]) -> 75.13605 | AO4: 75.13605
A5: Andorra | B5: of:=SUM([.C5:.AW5]) -> 100 | AW5: 100
A6: Angola | B6: of:=SUM([.C6:.AW6]) -> 66.03011 | AU6: 66.03011
A7: Anguilla | B7: of:=SUM([.C7:.AW7]) -> 95.4071 | Q7: 95.4071
A8: Antigua and Barbuda | B8: of:=SUM([.C8:.AW8]) -> 98.95 | AH8: 98.95
A9: Argentina | B9: of:=SUM([.C9:.AW9]) -> 98.09 | AV9: 98.09
A10: Armenia | B10: of:=SUM([.C10:.AW10]) -> 99.74441 | AR10: 99.74441
A11: Aruba | B11: of:=SUM([.C11:.AW11]) -> 96.82264 | AQ11: 96.82264
A12: Azerbaijan | B12: of:=SUM([.C12:.AW12]) -> 99.79006 | AW12: 99.79006
A13: Bahrain | B13: of:=SUM([.C13:.AW13]) -> 94.55679 | AQ13: 94.55679
A14: Bangladesh | B14: of:=SUM([.C14:.AW14]) -> 72.75872 | AW14: 72.75872
A15: Barbados | B15: of:=SUM([.C15:.AW15]) -> 99.26808 | C15: 99.26808
A16: Belarus | B16: of:=SUM([.C16:.AW16]) -> 99.61706 | AP16: 99.61706
A17: Belize | B17: of:=SUM([.C17:.AW17]) -> 70.29842 | X17: 70.29842
A18: Benin | B18: of:=SUM([.C18:.AW18]) -> 32.94882 | AS18: 32.94882
A19: Bhutan | B19: of:=SUM([.C19:.AW19]) -> 57.0336 | AS19: 57.0336
A20: Bolivia (Plurinational State of) | B20: of:=SUM([.C20:.AW20]) -> 92.45508 | AV20: 92.45508
A21: Bosnia and Herzegovina | B21: of:=SUM([.C21:.AW21]) -> 96.99177 | AT21: 96.99177
A22: Botswana | B22: of:=SUM([.C22:.AW22]) -> 81.18871 | AJ22: 81.18871
A23: Brazil | B23: of:=SUM([.C23:.AW23]) -> 91.72943 | AU23: 91.72943
A24: Brunei Darussalam | B24: of:=SUM([.C24:.AW24]) -> 96.08556 | AR24: 96.08556
A25: Bulgaria | B25: of:=SUM([.C25:.AW25]) -> 98.35245 | AR25: 98.35245
A26: Burkina Faso | B26: of:=SUM([.C26:.AW26]) -> 34.5994 | AU26: 34.5994
A27: Burundi | B27: of:=SUM([.C27:.AW27]) -> 61.56973 | AU27: 61.56973
A28: Cabo Verde | B28: of:=SUM([.C28:.AW28]) -> 86.79029 | AV28: 86.79029
A29: Cambodia | B29: of:=SUM([.C29:.AW29]) -> 73.90003 | AP29: 73.90003
A30: Cameroon | B30: of:=SUM([.C30:.AW30]) -> 71.29051 | AQ30: 71.29051
A31: Cayman Islands | B31: of:=SUM([.C31:.AW31]) -> 98.86782 | AN31: 98.86782
A32: Central African Republic | B32: of:=SUM([.C32:.AW32]) -> 36.75261 | AQ32: 36.75261
A33: Chad | B33: of:=SUM([.C33:.AW33]) -> 22.31155 | AW33: 22.31155
A34: Chile | B34: of:=SUM([.C34:.AW34]) -> 96.26706 | AT34: 96.26706
A35: China | B35: of:=SUM([.C35:.AW35]) -> 95.12448 | AQ35: 95.12448
A36: China, Macao Special Administrative Region | B36: of:=SUM([.C36:.AW36]) -> 96.53849 | AW36: 96.53849
A37: Colombia | B37: of:=SUM([.C37:.AW37]) -> 94.24505 | AV37: 94.24505
A38: Comoros | B38: of:=SUM([.C38:.AW38]) -> 49.19614 | AS38: 49.19614
A39: Congo | B39: of:=SUM([.C39:.AW39]) -> 79.31117 | AR39: 79.31117
A40: Costa Rica | B40: of:=SUM([.C40:.AW40]) -> 97.40658 | AR40: 97.40658
A41: Côte d'Ivoire | B41: of:=SUM([.C41:.AW41]) -> 43.90842 | AU41: 43.90842
A42: Croatia | B42: of:=SUM([.C42:.AW42]) -> 99.12536 | AR42: 99.12536
A43: Cuba | B43: of:=SUM([.C43:.AW43]) -> 99.75253 | AS43: 99.75253
A44: Cyprus | B44: of:=SUM([.C44:.AW44]) -> 98.67843 | AR44: 98.67843
A45: Democratic People's Republic of Korea | B45: of:=SUM([.C45:.AW45]) -> 99.99819 | AO45: 99.99819
A46: Democratic Republic of the Congo | B46: of:=SUM([.C46:.AW46]) -> 77.04268 | AW46: 77.04268
A47: Dominican Republic | B47: of:=SUM([.C47:.AW47]) -> 91.99121 | AV47: 91.99121
A48: Ecuador | B48: of:=SUM([.C48:.AW48]) -> 94.35023 | AW48: 94.35023
A49: Egypt | B49: of:=SUM([.C49:.AW49]) -> 75.06073 | AT49: 75.06073
A50: El Salvador | B50: of:=SUM([.C50:.AW50]) -> 87.96985 | AV50: 87.96985
A51: Equatorial Guinea | B51: of:=SUM([.C51:.AW51]) -> 88.3083 | AG51: 88.3083
A52: Eritrea | B52: of:=SUM([.C52:.AW52]) -> 64.66297 | AO52: 64.66297
A53: Estonia | B53: of:=SUM([.C53:.AW53]) -> 99.88579 | AR53: 99.88579
A54: Ethiopia | B54: of:=SUM([.C54:.AW54]) -> 38.99598 | AN54: 38.99598
A55: Gabon | B55: of:=SUM([.C55:.AW55]) -> 82.2838 | AS55: 82.2838
A56: Gambia | B56: of:=SUM([.C56:.AW56]) -> 41.95005 | AT56: 41.95005
A57: Georgia | B57: of:=SUM([.C57:.AW57]) -> 99.58619 | AU57: 99.58619
A58: Ghana | B58: of:=SUM([.C58:.AW58]) -> 71.49707 | AQ58: 71.49707
A59: Greece | B59: of:=SUM([.C59:.AW59]) -> 97.12875 | AR59: 97.12875
A60: Greenland | B60: of:=SUM([.C60:.AW60]) -> 100 | AV60: 100
A61: Grenada | B61: of:=SUM([.C61:.AW61]) -> 97.79447 | C61: 97.79447
A62: Guatemala | B62: of:=SUM([.C62:.AW62]) -> 81.2859 | AU62: 81.2859
A63: Guinea | B63: of:=SUM([.C63:.AW63]) -> 32.00386 | AU63: 32.00386
A64: Guinea-Bissau | B64: of:=SUM([.C64:.AW64]) -> 45.58116 | AU64: 45.58116
A65: Guyana | B65: of:=SUM([.C65:.AW65]) -> 85.63973 | AU65: 85.63973
A66: Haiti | B66: of:=SUM([.C66:.AW66]) -> 48.68502 | AM66: 48.68502
A67: Honduras | B67: of:=SUM([.C67:.AW67]) -> 88.98748 | AW67: 88.98748
A68: Hungary | B68: of:=SUM([.C68:.AW68]) -> 98.85829 | M68: 98.85829
A69: India | B69: of:=SUM([.C69:.AW69]) -> 69.30256 | AR69: 69.30256
A70: Indonesia | B70: of:=SUM([.C70:.AW70]) -> 95.37697 | AW70: 95.37697
A71: Iran (Islamic Republic of) | B71: of:=SUM([.C71:.AW71]) -> 84.70524 | AU71: 84.70524
A72: Iraq | B72: of:=SUM([.C72:.AW72]) -> 43.68328 | AT72: 43.68328
A73: Israel | B73: of:=SUM([.C73:.AW73]) -> 93.02869 | M73: 1.27728 | P73: 91.75141
A74: Italy | B74: of:=SUM([.C74:.AW74]) -> 98.84828 | AR74: 98.84828
A75: Jamaica | B75: of:=SUM([.C75:.AW75]) -> 79.92012 | AF75: 79.92012
A76: Jordan | B76: of:=SUM([.C76:.AW76]) -> 97.89032 | AS76: 97.89032
A77: Kazakhstan | B77: of:=SUM([.C77:.AW77]) -> 99.78163 | AQ77: 99.78163
A78: Kenya | B78: of:=SUM([.C78:.AW78]) -> 78.73304 | AU78: 78.73304
A79: Kuwait | B79: of:=SUM([.C79:.AW79]) -> 95.68545 | AV79: 95.68545
A80: Kyrgyzstan | B80: of:=SUM([.C80:.AW80]) -> 99.24343 | AP80: 99.24343
A81: Lao People's Democratic Republic | B81: of:=SUM([.C81:.AW81]) -> 58.28794 | AR81: 58.28794
A82: Latvia | B82: of:=SUM([.C82:.AW82]) -> 99.8959 | AR82: 99.8959
A83: Lebanon | B83: of:=SUM([.C83:.AW83]) -> 91.18419 | AP83: 91.18419
A84: Lesotho | B84: of:=SUM([.C84:.AW84]) -> 76.6352 | AU84: 76.6352
A85: Liberia | B85: of:=SUM([.C85:.AW85]) -> 42.94108 | AN85: 42.94108
A86: Libya | B86: of:=SUM([.C86:.AW86]) -> 60.16439 | Q86: 60.16439
A87: Lithuania | B87: of:=SUM([.C87:.AW87]) -> 99.8156 | AR87: 99.8156
A88: Madagascar | B88: of:=SUM([.C88:.AW88]) -> 71.57262 | AS88: 71.57262
A89: Malawi | B89: of:=SUM([.C89:.AW89]) -> 62.14354 | AV89: 62.14354
A90: Malaysia | B90: of:=SUM([.C90:.AW90]) -> 93.11789 | AQ90: 93.11789
A91: Maldives | B91: of:=SUM([.C91:.AW91]) -> 98.61012 | AU91: 98.61012
A92: Mali | B92: of:=SUM([.C92:.AW92]) -> 33.06889 | AV92: 33.06889
A93: Malta | B93: of:=SUM([.C93:.AW93]) -> 93.30736 | AR93: 93.30736
A94: Marshall Islands | B94: of:=SUM([.C94:.AW94]) -> 98.26508 | AR94: 98.26508
A95: Mauritania | B95: of:=SUM([.C95:.AW95]) -> 45.50378 | AN95: 45.50378
A96: Mauritius | B96: of:=SUM([.C96:.AW96]) -> 92.7076 | AV96: 92.7076
A97: Mexico | B97: of:=SUM([.C97:.AW97]) -> 94.47228 | AV97: 94.47228
A98: Mongolia | B98: of:=SUM([.C98:.AW98]) -> 98.257 | AQ98: 98.257
A99: Montenegro | B99: of:=SUM([.C99:.AW99]) -> 98.44221 | AR99: 98.44221
A100: Morocco | B100: of:=SUM([.C100:.AW100]) -> 69.42539 | AS100: 69.42539
A101: Mozambique | B101: of:=SUM([.C101:.AW101]) -> 50.58381 | AP101: 50.58381
A102: Myanmar | B102: of:=SUM([.C102:.AW102]) -> 75.5512 | AW102: 75.5512
A103: Namibia | B103: of:=SUM([.C103:.AW103]) -> 88.27463 | AR103: 88.27463
A104: Nepal | B104: of:=SUM([.C104:.AW104]) -> 59.62725 | AR104: 59.62725
A105: Nicaragua | B105: of:=SUM([.C105:.AW105]) -> 78.00298 | AL105: 78.00298
A106: Niger | B106: of:=SUM([.C106:.AW106]) -> 15.4567 | AS106: 15.4567
A107: Nigeria | B107: of:=SUM([.C107:.AW107]) -> 51.07766 | AO107: 51.07766
A108: Oman | B108: of:=SUM([.C108:.AW108]) -> 93.03861 | AV108: 93.03861
A109: Pakistan | B109: of:=SUM([.C109:.AW109]) -> 56.97715 | AU109: 56.97715
A110: Palau | B110: of:=SUM([.C110:.AW110]) -> 96.59374 | AV110: 96.59374
A111: Palestine | B111: of:=SUM([.C111:.AW111]) -> 96.93023 | AW111: 96.93023
A112: Panama | B112: of:=SUM([.C112:.AW112]) -> 94.09412 | AQ112: 94.09412
A113: Papua New Guinea | B113: of:=SUM([.C113:.AW113]) -> 57.34326 | AG113: 57.34326
A114: Paraguay | B114: of:=SUM([.C114:.AW114]) -> 95.0727 | AV114: 95.0727
A115: Peru | B115: of:=SUM([.C115:.AW115]) -> 94.17367 | AW115: 94.17367
A116: Philippines | B116: of:=SUM([.C116:.AW116]) -> 96.398 | AT116: 96.398
A117: Poland | B117: of:=SUM([.C117:.AW117]) -> 98.74274 | K117: 98.74274
A118: Portugal | B118: of:=SUM([.C118:.AW118]) -> 94.47705 | AR118: 94.47705
A119: Puerto Rico | B119: of:=SUM([.C119:.AW119]) -> 91.96523 | AQ119: 91.96523
A120: Qatar | B120: of:=SUM([.C120:.AW120]) -> 97.74669 | AU120: 97.74669
A121: Republic of Moldova | B121: of:=SUM([.C121:.AW121]) -> 99.13831 | AS121: 99.13831
A122: Romania | B122: of:=SUM([.C122:.AW122]) -> 98.60429 | AR122: 98.60429
A123: Russian Federation | B123: of:=SUM([.C123:.AW123]) -> 99.68427 | AQ123: 99.68427
A124: Rwanda | B124: of:=SUM([.C124:.AW124]) -> 68.33103 | AS124: 68.33103
A125: Saint Vincent and the Grenadines | B125: of:=SUM([.C125:.AW125]) -> 95.63216 | C125: 95.63216
A126: Samoa | B126: of:=SUM([.C126:.AW126]) -> 98.97326 | AR126: 98.97326
A127: Sao Tome and Principe | B127: of:=SUM([.C127:.AW127]) -> 90.1431 | AS127: 90.1431
A128: Saudi Arabia | B128: of:=SUM([.C128:.AW128]) -> 94.42634 | AT128: 94.42634
A129: Senegal | B129: of:=SUM([.C129:.AW129]) -> 42.8175 | AT129: 42.8175
A130: Serbia | B130: of:=SUM([.C130:.AW130]) -> 98.84151 | AW130: 98.84151
A131: Seychelles | B131: of:=SUM([.C131:.AW131]) -> 93.95423 | AQ131: 93.95423
A132: Sierra Leone | B132: of:=SUM([.C132:.AW132]) -> 32.42617 | AT132: 32.42617
A133: Singapore | B133: of:=SUM([.C133:.AW133]) -> 97.04959 | AW133: 97.04959
A134: Slovenia | B134: of:=SUM([.C134:.AW134]) -> 99.52452 | X134: 99.52452
A135: Solomon Islands | B135: of:=SUM([.C135:.AW135]) -> 76.6 | AF135: 76.6
A136: South Africa | B136: of:=SUM([.C136:.AW136]) -> 94.36792 | AV136: 94.36792
A137: South Sudan | B137: of:=SUM([.C137:.AW137]) -> 26.83128 | AO137: 26.83128
A138: Spain | B138: of:=SUM([.C138:.AW138]) -> 98.25051 | AW138: 98.25051
A139: Sri Lanka | B139: of:=SUM([.C139:.AW139]) -> 91.18136 | AQ139: 91.18136
A140: Sudan | B140: of:=SUM([.C140:.AW140]) -> 53.51738 | AO140: 53.51738
A141: Suriname | B141: of:=SUM([.C141:.AW141]) -> 92.86866 | AS141: 92.86866
A142: Swaziland | B142: of:=SUM([.C142:.AW142]) -> 83.09829 | AQ142: 83.09829
A143: Syrian Arab Republic | B143: of:=SUM([.C143:.AW143]) -> 80.84452 | AK143: 80.84452
A144: Tajikistan | B144: of:=SUM([.C144:.AW144]) -> 99.45068 | AG144: 99.45068
A145: Thailand | B145: of:=SUM([.C145:.AW145]) -> 92.86831 | AV145: 92.86831
A146: The former Yugoslav Republic of Macedonia | B146: of:=SUM([.C146:.AW146]) -> 96.12893 | AI146: 96.12893
A147: Timor-Leste | B147: of:=SUM([.C147:.AW147]) -> 58.30898 | AQ147: 58.30898
A148: Togo | B148: of:=SUM([.C148:.AW148]) -> 63.74562 | AV148: 63.74562
A149: Tonga | B149: of:=SUM([.C149:.AW149]) -> 99.38553 | AR149: 99.38553
A150: Trinidad and Tobago | B150: of:=SUM([.C150:.AW150]) -> 96.93855 | W150: 96.93855
A151: Tunisia | B151: of:=SUM([.C151:.AW151]) -> 79.03643 | AU151: 79.03643
A152: Turkey | B152: of:=SUM([.C152:.AW152]) -> 95.60142 | AV152: 95.60142
A153: Turkmenistan | B153: of:=SUM([.C153:.AW153]) -> 98.77832 | AB153: 98.77832
A154: Uganda | B154: of:=SUM([.C154:.AW154]) -> 70.19822 | AS154: 70.19822
A155: Ukraine | B155: of:=SUM([.C155:.AW155]) -> 99.97435 | AS155: 99.97435
A156: United Arab Emirates | B156: of:=SUM([.C156:.AW156]) -> 90.03385 | AL156: 90.03385
A157: United Republic of Tanzania | B157: of:=SUM([.C157:.AW157]) -> 77.88723 | AV157: 77.88723
A158: Uruguay | B158: of:=SUM([.C158:.AW158]) -> 98.52387 | AV158: 98.52387
A159: Uzbekistan | B159: of:=SUM([.C159:.AW159]) -> 99.98383 | AV159: 99.98383
A160: Vanuatu | B160: of:=SUM([.C160:.AW160]) -> 74 | AF160: 74
A161: Venezuela (Bolivarian Republic of) | B161: of:=SUM([.C161:.AW161]) -> 97.12709 | AW161: 97.12709
A162: Viet Nam | B162: of:=SUM([.C162:.AW162]) -> 93.52045 | AP162: 93.52045
A163: Yemen | B163: of:=SUM([.C163:.AW163]) -> 37.09 | AA163: 37.09
A164: Zambia | B164: of:=SUM([.C164:.AW164]) -> 83.00767 | AQ164: 83.00767
A165: Zimbabwe | B165: of:=SUM([.C165:.AW165]) -> 88.69342 | AU165: 88.69342

Sheet: Bilan
A1: Country | B1: Litteracy rate | C1: Education exp
A2: of:=[$lit.A2] -> Afghanistan | B2: of:=[$lit.B2] -> 31.74112 | C2: of:=VLOOKUP([.A2];[$gdp.A2:.B200];2) -> 3.31754
A3: of:=[$lit.A3] -> Albania | B3: of:=[$lit.B3] -> 97.24697 | C3: of:=VLOOKUP([.A3];[$gdp.A3:.B201];2) -> 3.53944
A4: of:=[$lit.A4] -> Algeria | B4: of:=[$lit.B4] -> 75.13605 | C4: of:=VLOOKUP([.A4];[$gdp.A4:.B202];2) -> 4.35425
A5: of:=[$lit.A5] -> Andorra | B5: of:=[$lit.B5] -> 100 | C5: of:=VLOOKUP([.A5];[$gdp.A5:.B203];2) -> 3.25368
A6: of:=[$lit.A6] -> Angola | B6: of:=[$lit.B6] -> 66.03011 | C6: of:=VLOOKUP([.A6];[$gdp.A6:.B204];2) -> 3.47623
A7: of:=[$lit.A7] -> Anguilla | B7: of:=[$lit.B7] -> 95.4071 | C7: of:=VLOOKUP([.A7];[$gdp.A7:.B205];2) -> 2.84263
A8: of:=[$lit.A8] -> Antigua and Barbuda | B8: of:=[$lit.B8] -> 98.95 | C8: of:=VLOOKUP([.A8];[$gdp.A8:.B206];2) -> 2.55447
A9: of:=[$lit.A9] -> Argentina | B9: of:=[$lit.B9] -> 98.09 | C9: of:=VLOOKUP([.A9];[$gdp.A9:.B207];2) -> 5.32549
A10: of:=[$lit.A10] -> Armenia | B10: of:=[$lit.B10] -> 99.74441 | C10: of:=VLOOKUP([.A10];[$gdp.A10:.B208];2) -> 2.81351
A11: of:=[$lit.A11] -> Aruba | B11: of:=[$lit.B11] -> 96.82264 | C11: of:=VLOOKUP([.A11];[$gdp.A11:.B209];2) -> 6.16293
A12: of:=[$lit.A12] -> Azerbaijan | B12: of:=[$lit.B12] -> 99.79006 | C12: of:=VLOOKUP([.A12];[$gdp.A12:.B210];2) -> 2.63466
A13: of:=[$lit.A13] -> Bahrain | B13: of:=[$lit.B13] -> 94.55679 | C13: of:=VLOOKUP([.A13];[$gdp.A13:.B211];2) -> 2.66808
A14: of:=[$lit.A14] -> Bangladesh | B14: of:=[$lit.B14] -> 72.75872 | C14: of:=VLOOKUP([.A14];[$gdp.A14:.B212];2) -> 1.92634
A15: of:=[$lit.A15] -> Barbados | B15: of:=[$lit.B15] -> 99.26808 | C15: of:=VLOOKUP([.A15];[$gdp.A15:.B213];2) -> 6.5733
A16: of:=[$lit.A16] -> Belarus | B16: of:=[$lit.B16] -> 99.61706 | C16: of:=VLOOKUP([.A16];[$gdp.A16:.B214];2) -> 4.94765
A17: of:=[$lit.A17] -> Belize | B17: of:=[$lit.B17] -> 70.29842 | C17: of:=VLOOKUP([.A17];[$gdp.A17:.B215];2) -> 6.42584
A18: of:=[$lit.A18] -> Benin | B18: of:=[$lit.B18] -> 32.94882 | C18: of:=VLOOKUP([.A18];[$gdp.A18:.B216];2) -> 4.35981
A19: of:=[$lit.A19] -> Bhutan | B19: of:=[$lit.B19] -> 57.0336 | C19: of:=VLOOKUP([.A19];[$gdp.A19:.B217];2) -> 7.36169
A20: of:=[$lit.A20] -> Bolivia (Plurinational State of) | B20: of:=[$lit.B20] -> 92.45508 | C20: of:=VLOOKUP([.A20];[$gdp.A20:.B218];2) -> 7.28546
A21: of:=[$lit.A21] -> Bosnia and Herzegovina | B21: of:=[$lit.B21] -> 96.99177 | C21: of:=VLOOKUP([.A21];[$gdp.A21:.B219];2) -> 7.28546
A22: of:=[$lit.A22] -> Botswana | B22: of:=[$lit.B22] -> 81.18871 | C22: of:=VLOOKUP([.A22];[$gdp.A22:.B220];2) -> 9.63292
A23: of:=[$lit.A23] -> Brazil | B23: of:=[$lit.B23] -> 91.72943 | C23: of:=VLOOKUP([.A23];[$gdp.A23:.B221];2) -> 5.99395
A24: of:=[$lit.A24] -> Brunei Darussalam | B24: of:=[$lit.B24] -> 96.08556 | C24: of:=VLOOKUP([.A24];[$gdp.A24:.B222];2) -> 4.42541
A25: of:=[$lit.A25] -> Bulgaria | B25: of:=[$lit.B25] -> 98.35245 | C25: of:=VLOOKUP([.A25];[$gdp.A25:.B223];2) -> 4.06197
A26: of:=[$lit.A26] -> Burkina Faso | B26: of:=[$lit.B26] -> 34.5994 | C26: of:=VLOOKUP([.A26];[$gdp.A26:.B224];2) -> 4.06224
A27: of:=[$lit.A27] -> Burundi | B27: of:=[$lit.B27] -> 61.56973 | C27: of:=VLOOKUP([.A27];[$gdp.A27:.B225];2) -> 5.41642
A28: of:=[$lit.A28] -> Cabo Verde | B28: of:=[$lit.B28] -> 86.79029 | C28: of:=VLOOKUP([.A28];[$gdp.A28:.B226];2) -> 4.99245
A29: of:=[$lit.A29] -> Cambodia | B29: of:=[$lit.B29] -> 73.90003 | C29: of:=VLOOKUP([.A29];[$gdp.A29:.B227];2) -> 1.90197
A30: of:=[$lit.A30] -> Cameroon | B30: of:=[$lit.B30] -> 71.29051 | C30: of:=VLOOKUP([.A30];[$gdp.A30:.B228];2) -> 3.0299
A31: of:=[$lit.A31] -> Cayman Islands | B31: of:=[$lit.B31] -> 98.86782 | C31: of:=VLOOKUP([.A31];[$gdp.A31:.B229];2) -> 5.28122
A32: of:=[$lit.A32] -> Central African Republic | B32: of:=[$lit.B32] -> 36.75261 | C32: of:=VLOOKUP([.A32];[$gdp.A32:.B230];2) -> 1.22393
A33: of:=[$lit.A33] -> Chad | B33: of:=[$lit.B33] -> 22.31155 | C33: of:=VLOOKUP([.A33];[$gdp.A33:.B231];2) -> 2.84971
A34: of:=[$lit.A34] -> Chile | B34: of:=[$lit.B34] -> 96.26706 | C34: of:=VLOOKUP([.A34];[$gdp.A34:.B232];2) -> 4.92324
A35: of:=[$lit.A35] -> China | B35: of:=[$lit.B35] -> 95.12448 | C35: of:=VLOOKUP([.A35];[$gdp.A35:.B233];2) -> 1.8873
A36: of:=[$lit.A36] -> China, Macao Special Administrative Region | B36: of:=[$lit.B36] -> 96.53849 | C36: of:=VLOOKUP([.A36];[$gdp.A36:.B234];2) -> 2.02779
A37: of:=[$lit.A37] -> Colombia | B37: of:=[$lit.B37] -> 94.24505 | C37: of:=VLOOKUP([.A37];[$gdp.A37:.B235];2) -> 4.49099
A38: of:=[$lit.A38] -> Comoros | B38: of:=[$lit.B38] -> 49.19614 | C38: of:=VLOOKUP([.A38];[$gdp.A38:.B236];2) -> 4.34329
A39: of:=[$lit.A39] -> Congo | B39: of:=[$lit.B39] -> 79.31117 | C39: of:=VLOOKUP([.A39];[$gdp.A39:.B237];2) -> 6.21789
A40: of:=[$lit.A40] -> Costa Rica | B40: of:=[$lit.B40] -> 97.40658 | C40: of:=VLOOKUP([.A40];[$gdp.A40:.B238];2) -> 7.17601
A41: of:=[$lit.A41] -> Côte d'Ivoire | B41: of:=[$lit.B41] -> 43.90842 | C41: of:=VLOOKUP([.A41];[$gdp.A41:.B239];2) -> 5.03422
A42: of:=[$lit.A42] -> Croatia | B42: of:=[$lit.B42] -> 99.12536 | C42: of:=VLOOKUP([.A42];[$gdp.A42:.B240];2) -> 4.5816
A43: of:=[$lit.A43] -> Cuba | B43: of:=[$lit.B43] -> 99.75253 | C43: of:=VLOOKUP([.A43];[$gdp.A43:.B241];2) -> 12.83727
A44: of:=[$lit.A44] -> Cyprus | B44: of:=[$lit.B44] -> 98.67843 | C44: of:=VLOOKUP([.A44];[$gdp.A44:.B242];2) -> 6.13839
A45: of:=[$lit.A45] -> Democratic People's Republic of Korea | B45: of:=[$lit.B45] -> 99.99819 | C45: of:=VLOOKUP([.A45];[$gdp.A45:.B243];2) -> 4.08902
A46: of:=[$lit.A46] -> Democratic Republic of the Congo | B46: of:=[$lit.B46] -> 77.04268 | C46: of:=VLOOKUP([.A46];[$gdp.A46:.B244];2) -> 2.24535
A47: of:=[$lit.A47] -> Dominican Republic | B47: of:=[$lit.B47] -> 91.99121 | C47: of:=VLOOKUP([.A47];[$gdp.A47:.B245];2) -> 2.04457
A48: of:=[$lit.A48] -> Ecuador | B48: of:=[$lit.B48] -> 94.35023 | C48: of:=VLOOKUP([.A48];[$gdp.A48:.B246];2) -> 4.96322
A49: of:=[$lit.A49] -> Egypt | B49: of:=[$lit.B49] -> 75.06073 | C49: of:=VLOOKUP([.A49];[$gdp.A49:.B247];2) -> 3.75873
A50: of:=[$lit.A50] -> El Salvador | B50: of:=[$lit.B50] -> 87.96985 | C50: of:=VLOOKUP([.A50];[$gdp.A50:.B248];2) -> 3.54506
A51: of:=[$lit.A51] -> Equatorial Guinea | B51: of:=[$lit.B51] -> 88.3083 | C51: of:=VLOOKUP([.A51];[$gdp.A51:.B249];2) -> 2.18486
A52: of:=[$lit.A52] -> Eritrea | B52: of:=[$lit.B52] -> 64.66297 | C52: of:=VLOOKUP([.A52];[$gdp.A52:.B250];2) -> 2.127
A53: of:=[$lit.A53] -> Estonia | B53: of:=[$lit.B53] -> 99.88579 | C53: of:=VLOOKUP([.A53];[$gdp.A53:.B251];2) -> 5.48164
A54: of:=[$lit.A54] -> Ethiopia | B54: of:=[$lit.B54] -> 38.99598 | C54: of:=VLOOKUP([.A54];[$gdp.A54:.B252];2) -> 4.50051
A55: of:=[$lit.A55] -> Gabon | B55: of:=[$lit.B55] -> 82.2838 | C55: of:=VLOOKUP([.A55];[$gdp.A55:.B253];2) -> 2.66617
A56: of:=[$lit.A56] -> Gambia | B56: of:=[$lit.B56] -> 41.95005 | C56: of:=VLOOKUP([.A56];[$gdp.A56:.B254];2) -> 2.76771
A57: of:=[$lit.A57] -> Georgia | B57: of:=[$lit.B57] -> 99.58619 | C57: of:=VLOOKUP([.A57];[$gdp.A57:.B255];2) -> 1.98331
A58: of:=[$lit.A58] -> Ghana | B58: of:=[$lit.B58] -> 71.49707 | C58: of:=VLOOKUP([.A58];[$gdp.A58:.B256];2) -> 6.17855
A59: of:=[$lit.A59] -> Greece | B59: of:=[$lit.B59] -> 97.12875 | C59: of:=VLOOKUP([.A59];[$gdp.A59:.B257];2) -> 3.96878
A60: of:=[$lit.A60] -> Greenland | B60: of:=[$lit.B60] -> 100 | C60: of:=VLOOKUP([.A60];[$gdp.A60:.B258];2) -> 3.96878
A61: of:=[$lit.A61] -> Grenada | B61: of:=[$lit.B61] -> 97.79447 | C61: of:=VLOOKUP([.A61];[$gdp.A61:.B259];2) -> 3.92674
A62: of:=[$lit.A62] -> Guatemala | B62: of:=[$lit.B62] -> 81.2859 | C62: of:=VLOOKUP([.A62];[$gdp.A62:.B260];2) -> 2.95595
A63: of:=[$lit.A63] -> Guinea | B63: of:=[$lit.B63] -> 32.00386 | C63: of:=VLOOKUP([.A63];[$gdp.A63:.B261];2) -> 3.20817
A64: of:=[$lit.A64] -> Guinea-Bissau | B64: of:=[$lit.B64] -> 45.58116 | C64: of:=VLOOKUP([.A64];[$gdp.A64:.B262];2) -> 2.17313
A65: of:=[$lit.A65] -> Guyana | B65: of:=[$lit.B65] -> 85.63973 | C65: of:=VLOOKUP([.A65];[$gdp.A65:.B263];2) -> 3.19216
A66: of:=[$lit.A66] -> Haiti | B66: of:=[$lit.B66] -> 48.68502 | C66: of:=VLOOKUP([.A66];[$gdp.A66:.B264];2) -> 1.07399
A67: of:=[$lit.A67] -> Honduras | B67: of:=[$lit.B67] -> 88.98748 | C67: of:=VLOOKUP([.A67];[$gdp.A67:.B265];2) -> 5.86775
A68: of:=[$lit.A68] -> Hungary | B68: of:=[$lit.B68] -> 98.85829 | C68: of:=VLOOKUP([.A68];[$gdp.A68:.B266];2) -> 4.65935
A69: of:=[$lit.A69] -> India | B69: of:=[$lit.B69] -> 69.30256 | C69: of:=VLOOKUP([.A69];[$gdp.A69:.B267];2) -> 3.84236
A70: of:=[$lit.A70] -> Indonesia | B70: of:=[$lit.B70] -> 95.37697 | C70: of:=VLOOKUP([.A70];[$gdp.A70:.B268];2) -> 3.59181
A71: of:=[$lit.A71] -> Iran (Islamic Republic of) | B71: of:=[$lit.B71] -> 84.70524 | C71: of:=VLOOKUP([.A71];[$gdp.A71:.B269];2) -> 2.92899
A72: of:=[$lit.A72] -> Iraq | B72: of:=[$lit.B72] -> 43.68328 | C72: of:=VLOOKUP([.A72];[$gdp.A72:.B270];2) -> 3.5515
A73: of:=[$lit.A73] -> Israel | B73: of:=[$lit.B73] -> 93.02869 | C73: of:=VLOOKUP([.A73];[$gdp.A73:.B271];2) -> 5.75727
A74: of:=[$lit.A74] -> Italy | B74: of:=[$lit.B74] -> 98.84828 | C74: of:=VLOOKUP([.A74];[$gdp.A74:.B272];2) -> 4.07985
A75: of:=[$lit.A75] -> Jamaica | B75: of:=[$lit.B75] -> 79.92012 | C75: of:=VLOOKUP([.A75];[$gdp.A75:.B273];2) -> 5.46196
A76: of:=[$lit.A76] -> Jordan | B76: of:=[$lit.B76] -> 97.89032 | C76: of:=VLOOKUP([.A76];[$gdp.A76:.B274];2) -> 4.94514
A77: of:=[$lit.A77] -> Kazakhstan | B77: of:=[$lit.B77] -> 99.78163 | C77: of:=VLOOKUP([.A77];[$gdp.A77:.B275];2) -> 2.7875
A78: of:=[$lit.A78] -> Kenya | B78: of:=[$lit.B78] -> 78.73304 | C78: of:=VLOOKUP([.A78];[$gdp.A78:.B276];2) -> 5.27392
A79: of:=[$lit.A79] -> Kuwait | B79: of:=[$lit.B79] -> 95.68545 | C79: of:=VLOOKUP([.A79];[$gdp.A79:.B277];2) -> 3.76001
A80: of:=[$lit.A80] -> Kyrgyzstan | B80: of:=[$lit.B80] -> 99.24343 | C80: of:=VLOOKUP([.A80];[$gdp.A80:.B278];2) -> 5.52738
A81: of:=[$lit.A81] -> Lao People's Democratic Republic | B81: of:=[$lit.B81] -> 58.28794 | C81: of:=VLOOKUP([.A81];[$gdp.A81:.B279];2) -> 3.32011
A82: of:=[$lit.A82] -> Latvia | B82: of:=[$lit.B82] -> 99.8959 | C82: of:=VLOOKUP([.A82];[$gdp.A82:.B280];2) -> 5.28524
A83: of:=[$lit.A83] -> Lebanon | B83: of:=[$lit.B83] -> 91.18419 | C83: of:=VLOOKUP([.A83];[$gdp.A83:.B281];2) -> 2.57119
A84: of:=[$lit.A84] -> Lesotho | B84: of:=[$lit.B84] -> 76.6352 | C84: of:=VLOOKUP([.A84];[$gdp.A84:.B282];2) -> 11.36114
A85: of:=[$lit.A85] -> Liberia | B85: of:=[$lit.B85] -> 42.94108 | C85: of:=VLOOKUP([.A85];[$gdp.A85:.B283];2) -> 2.75756
A86: of:=[$lit.A86] -> Libya | B86: of:=[$lit.B86] -> 60.16439 | C86: of:=VLOOKUP([.A86];[$gdp.A86:.B284];2) -> 2.26417
A87: of:=[$lit.A87] -> Lithuania | B87: of:=[$lit.B87] -> 99.8156 | C87: of:=VLOOKUP([.A87];[$gdp.A87:.B285];2) -> 4.6125
A88: of:=[$lit.A88] -> Madagascar | B88: of:=[$lit.B88] -> 71.57262 | C88: of:=VLOOKUP([.A88];[$gdp.A88:.B286];2) -> 2.08204
A89: of:=[$lit.A89] -> Malawi | B89: of:=[$lit.B89] -> 62.14354 | C89: of:=VLOOKUP([.A89];[$gdp.A89:.B287];2) -> 5.60799
A90: of:=[$lit.A90] -> Malaysia | B90: of:=[$lit.B90] -> 93.11789 | C90: of:=VLOOKUP([.A90];[$gdp.A90:.B288];2) -> 4.96636
A91: of:=[$lit.A91] -> Maldives | B91: of:=[$lit.B91] -> 98.61012 | C91: of:=VLOOKUP([.A91];[$gdp.A91:.B289];2) -> 5.22351
A92: of:=[$lit.A92] -> Mali | B92: of:=[$lit.B92] -> 33.06889 | C92: of:=VLOOKUP([.A92];[$gdp.A92:.B290];2) -> 3.73929
A93: of:=[$lit.A93] -> Malta | B93: of:=[$lit.B93] -> 93.30736 | C93: of:=VLOOKUP([.A93];[$gdp.A93:.B291];2) -> 7.849
A94: of:=[$lit.A94] -> Marshall Islands | B94: of:=[$lit.B94] -> 98.26508 | C94: of:=VLOOKUP([.A94];[$gdp.A94:.B292];2) -> 12.23999
A95: of:=[$lit.A95] -> Mauritania | B95: of:=[$lit.B95] -> 45.50378 | C95: of:=VLOOKUP([.A95];[$gdp.A95:.B293];2) -> 2.93012
A96: of:=[$lit.A96] -> Mauritius | B96: of:=[$lit.B96] -> 92.7076 | C96: of:=VLOOKUP([.A96];[$gdp.A96:.B294];2) -> 4.88539
A97: of:=[$lit.A97] -> Mexico | B97: of:=[$lit.B97] -> 94.47228 | C97: of:=VLOOKUP([.A97];[$gdp.A97:.B295];2) -> 5.31348
A98: of:=[$lit.A98] -> Mongolia | B98: of:=[$lit.B98] -> 98.257 | C98: of:=VLOOKUP([.A98];[$gdp.A98:.B296];2) -> 4.59987
A99: of:=[$lit.A99] -> Montenegro | B99: of:=[$lit.B99] -> 98.44221 | C99: of:=VLOOKUP([.A99];[$gdp.A99:.B297];2) -> 4.59987
A100: of:=[$lit.A100] -> Morocco | B100: of:=[$lit.B100] -> 69.42539 | C100: of:=VLOOKUP([.A100];[$gdp.A100:.B298];2) -> 5.26404
A101: of:=[$lit.A101] -> Mozambique | B101: of:=[$lit.B101] -> 50.58381 | C101: of:=VLOOKUP([.A101];[$gdp.A101:.B299];2) -> 6.48322
A102: of:=[$lit.A102] -> Myanmar | B102: of:=[$lit.B102] -> 75.5512 | C102: of:=VLOOKUP([.A102];[$gdp.A102:.B300];2) -> 1.2019
A103: of:=[$lit.A103] -> Namibia | B103: of:=[$lit.B103] -> 88.27463 | C103: of:=VLOOKUP([.A103];[$gdp.A103:.B301];2) -> 8.34961
A104: of:=[$lit.A104] -> Nepal | B104: of:=[$lit.B104] -> 59.62725 | C104: of:=VLOOKUP([.A104];[$gdp.A104:.B302];2) -> 3.71216
A105: of:=[$lit.A105] -> Nicaragua | B105: of:=[$lit.B105] -> 78.00298 | C105: of:=VLOOKUP([.A105];[$gdp.A105:.B303];2) -> 4.48549
A106: of:=[$lit.A106] -> Niger | B106: of:=[$lit.B106] -> 15.4567 | C106: of:=VLOOKUP([.A106];[$gdp.A106:.B304];2) -> 6.70941
A107: of:=[$lit.A107] -> Nigeria | B107: of:=[$lit.B107] -> 51.07766 | C107: of:=VLOOKUP([.A107];[$gdp.A107:.B305];2) -> 3.06369
A108: of:=[$lit.A108] -> Oman | B108: of:=[$lit.B108] -> 93.03861 | C108: of:=VLOOKUP([.A108];[$gdp.A108:.B306];2) -> 4.96038
A109: of:=[$lit.A109] -> Pakistan | B109: of:=[$lit.B109] -> 56.97715 | C109: of:=VLOOKUP([.A109];[$gdp.A109:.B307];2) -> 2.64674
A110: of:=[$lit.A110] -> Palau | B110: of:=[$lit.B110] -> 96.59374 | C110: of:=VLOOKUP([.A110];[$gdp.A110:.B308];2) -> 7.50749
A111: of:=[$lit.A111] -> Palestine | B111: of:=[$lit.B111] -> 96.93023 | C111: of:=VLOOKUP([.A111];[$gdp.A111:.B309];2) -> 1.32232
A112: of:=[$lit.A112] -> Panama | B112: of:=[$lit.B112] -> 94.09412 | C112: of:=VLOOKUP([.A112];[$gdp.A112:.B310];2) -> 3.18772
A113: of:=[$lit.A113] -> Papua New Guinea | B113: of:=[$lit.B113] -> 57.34326 | C113: of:=VLOOKUP([.A113];[$gdp.A113:.B311];2) -> 7.38971
A114: of:=[$lit.A114] -> Paraguay | B114: of:=[$lit.B114] -> 95.0727 | C114: of:=VLOOKUP([.A114];[$gdp.A114:.B312];2) -> 4.9554
A115: of:=[$lit.A115] -> Peru | B115: of:=[$lit.B115] -> 94.17367 | C115: of:=VLOOKUP([.A115];[$gdp.A115:.B313];2) -> 3.97865
A116: of:=[$lit.A116] -> Philippines | B116: of:=[$lit.B116] -> 96.398 | C116: of:=VLOOKUP([.A116];[$gdp.A116:.B314];2) -> 2.65168
A117: of:=[$lit.A117] -> Poland | B117: of:=[$lit.B117] -> 98.74274 | C117: of:=VLOOKUP([.A117];[$gdp.A117:.B315];2) -> 4.91175
A118: of:=[$lit.A118] -> Portugal | B118: of:=[$lit.B118] -> 94.47705 | C118: of:=VLOOKUP([.A118];[$gdp.A118:.B316];2) -> 5.12559
A119: of:=[$lit.A119] -> Puerto Rico | B119: of:=[$lit.B119] -> 91.96523 | C119: of:=VLOOKUP([.A119];[$gdp.A119:.B317];2) -> 6.39077
A120: of:=[$lit.A120] -> Qatar | B120: of:=[$lit.B120] -> 97.74669 | C120: of:=VLOOKUP([.A120];[$gdp.A120:.B318];2) -> 3.60719
A121: of:=[$lit.A121] -> Republic of Moldova | B121: of:=[$lit.B121] -> 99.13831 | C121: of:=VLOOKUP([.A121];[$gdp.A121:.B319];2) -> 7.46784
A122: of:=[$lit.A122] -> Romania | B122: of:=[$lit.B122] -> 98.60429 | C122: of:=VLOOKUP([.A122];[$gdp.A122:.B320];2) -> 3.12918
A123: of:=[$lit.A123] -> Russian Federation | B123: of:=[$lit.B123] -> 99.68427 | C123: of:=VLOOKUP([.A123];[$gdp.A123:.B321];2) -> 3.86133
A124: of:=[$lit.A124] -> Rwanda | B124: of:=[$lit.B124] -> 68.33103 | C124: of:=VLOOKUP([.A124];[$gdp.A124:.B322];2) -> 3.61734
A125: of:=[$lit.A125] -> Saint Vincent and the Grenadines | B125: of:=[$lit.B125] -> 95.63216 | C125: of:=VLOOKUP([.A125];[$gdp.A125:.B323];2) -> 5.08523
A126: of:=[$lit.A126] -> Samoa | B126: of:=[$lit.B126] -> 98.97326 | C126: of:=VLOOKUP([.A126];[$gdp.A126:.B324];2) -> 5.14421
A127: of:=[$lit.A127] -> Sao Tome and Principe | B127: of:=[$lit.B127] -> 90.1431 | C127: of:=VLOOKUP([.A127];[$gdp.A127:.B325];2) -> 3.75682
A128: of:=[$lit.A128] -> Saudi Arabia | B128: of:=[$lit.B128] -> 94.42634 | C128: of:=VLOOKUP([.A128];[$gdp.A128:.B326];2) -> 5.13581
A129: of:=[$lit.A129] -> Senegal | B129: of:=[$lit.B129] -> 42.8175 | C129: of:=VLOOKUP([.A129];[$gdp.A129:.B327];2) -> 7.3962
A130: of:=[$lit.A130] -> Serbia | B130: of:=[$lit.B130] -> 98.84151 | C130: of:=VLOOKUP([.A130];[$gdp.A130:.B328];2) -> 4.17861
A131: of:=[$lit.A131] -> Seychelles | B131: of:=[$lit.B131] -> 93.95423 | C131: of:=VLOOKUP([.A131];[$gdp.A131:.B329];2) -> 3.60644
A132: of:=[$lit.A132] -> Sierra Leone | B132: of:=[$lit.B132] -> 32.42617 | C132: of:=VLOOKUP([.A132];[$gdp.A132:.B330];2) -> 2.66167
A133: of:=[$lit.A133] -> Singapore | B133: of:=[$lit.B133] -> 97.04959 | C133: of:=VLOOKUP([.A133];[$gdp.A133:.B331];2) -> 2.91579
A134: of:=[$lit.A134] -> Slovenia | B134: of:=[$lit.B134] -> 99.52452 | C134: of:=VLOOKUP([.A134];[$gdp.A134:.B332];2) -> 5.48659
A135: of:=[$lit.A135] -> Solomon Islands | B135: of:=[$lit.B135] -> 76.6 | C135: of:=VLOOKUP([.A135];[$gdp.A135:.B333];2) -> 10.00108
A136: of:=[$lit.A136] -> South Africa | B136: of:=[$lit.B136] -> 94.36792 | C136: of:=VLOOKUP([.A136];[$gdp.A136:.B334];2) -> 6.02955
A137: of:=[$lit.A137] -> South Sudan | B137: of:=[$lit.B137] -> 26.83128 | C137: of:=VLOOKUP([.A137];[$gdp.A137:.B335];2) -> 1.81094
A138: of:=[$lit.A138] -> Spain | B138: of:=[$lit.B138] -> 98.25051 | C138: of:=VLOOKUP([.A138];[$gdp.A138:.B336];2) -> 4.27093
A139: of:=[$lit.A139] -> Sri Lanka | B139: of:=[$lit.B139] -> 91.18136 | C139: of:=VLOOKUP([.A139];[$gdp.A139:.B337];2) -> 2.17912
A140: of:=[$lit.A140] -> Sudan | B140: of:=[$lit.B140] -> 53.51738 | C140: of:=VLOOKUP([.A140];[$gdp.A140:.B338];2) -> 2.22459
A141: of:=[$lit.A141] -> Suriname | B141: of:=[$lit.B141] -> 92.86866 | C141: of:=VLOOKUP([.A141];[$gdp.A141:.B339];2) -> 2.22459
A142: of:=[$lit.A142] -> Swaziland | B142: of:=[$lit.B142] -> 83.09829 | C142: of:=VLOOKUP([.A142];[$gdp.A142:.B340];2) -> 7.04999
A143: of:=[$lit.A143] -> Syrian Arab Republic | B143: of:=[$lit.B143] -> 80.84452 | C143: of:=VLOOKUP([.A143];[$gdp.A143:.B341];2) -> 5.13014
A144: of:=[$lit.A144] -> Tajikistan | B144: of:=[$lit.B144] -> 99.45068 | C144: of:=VLOOKUP([.A144];[$gdp.A144:.B342];2) -> 5.23215
A145: of:=[$lit.A145] -> Thailand | B145: of:=[$lit.B145] -> 92.86831 | C145: of:=VLOOKUP([.A145];[$gdp.A145:.B343];2) -> 4.12887
A146: of:=[$lit.A146] -> The former Yugoslav Republic of Macedonia | B146: of:=[$lit.B146] -> 96.12893 | C146: of:=VLOOKUP([.A146];[$gdp.A146:.B344];2) -> 3.29481
A147: of:=[$lit.A147] -> Timor-Leste | B147: of:=[$lit.B147] -> 58.30898 | C147: of:=VLOOKUP([.A147];[$gdp.A147:.B345];2) -> 7.775
A148: of:=[$lit.A148] -> Togo | B148: of:=[$lit.B148] -> 63.74562 | C148: of:=VLOOKUP([.A148];[$gdp.A148:.B346];2) -> 5.2179
A149: of:=[$lit.A149] -> Tonga | B149: of:=[$lit.B149] -> 99.38553 | C149: of:=VLOOKUP([.A149];[$gdp.A149:.B347];2) -> 3.90804
A150: of:=[$lit.A150] -> Trinidad and Tobago | B150: of:=[$lit.B150] -> 96.93855 | C150: of:=VLOOKUP([.A150];[$gdp.A150:.B348];2) -> 3.1366
A151: of:=[$lit.A151] -> Tunisia | B151: of:=[$lit.B151] -> 79.03643 | C151: of:=VLOOKUP([.A151];[$gdp.A151:.B349];2) -> 6.25036
A152: of:=[$lit.A152] -> Turkey | B152: of:=[$lit.B152] -> 95.60142 | C152: of:=VLOOKUP([.A152];[$gdp.A152:.B350];2) -> 4.76626
A153: of:=[$lit.A153] -> Turkmenistan | B153: of:=[$lit.B153] -> 98.77832 | C153: of:=VLOOKUP([.A153];[$gdp.A153:.B351];2) -> 3.0559
A154: of:=[$lit.A154] -> Uganda | B154: of:=[$lit.B154] -> 70.19822 | C154: of:=VLOOKUP([.A154];[$gdp.A154:.B352];2) -> 2.21387
A155: of:=[$lit.A155] -> Ukraine | B155: of:=[$lit.B155] -> 99.97435 | C155: of:=VLOOKUP([.A155];[$gdp.A155:.B353];2) -> 5.86354
A156: of:=[$lit.A156] -> United Arab Emirates | B156: of:=[$lit.B156] -> 90.03385 | C156: of:=VLOOKUP([.A156];[$gdp.A156:.B354];2) -> 1.11104
A157: of:=[$lit.A157] -> United Republic of Tanzania | B157: of:=[$lit.B157] -> 77.88723 | C157: of:=VLOOKUP([.A157];[$gdp.A157:.B355];2) -> 3.47914
A158: of:=[$lit.A158] -> Uruguay | B158: of:=[$lit.B158] -> 98.52387 | C158: of:=VLOOKUP([.A158];[$gdp.A158:.B356];2) -> 4.35694
A159: of:=[$lit.A159] -> Uzbekistan | B159: of:=[$lit.B159] -> 99.98383 | C159: of:=VLOOKUP([.A159];[$gdp.A159:.B357];2) -> 4.35694
A160: of:=[$lit.A160] -> Vanuatu | B160: of:=[$lit.B160] -> 74 | C160: of:=VLOOKUP([.A160];[$gdp.A160:.B358];2) -> 5.54987
A161: of:=[$lit.A161] -> Venezuela (Bolivarian Republic of) | B161: of:=[$lit.B161] -> 97.12709 | C161: of:=VLOOKUP([.A161];[$gdp.A161:.B359];2) -> 6.87723
A162: of:=[$lit.A162] -> Viet Nam | B162: of:=[$lit.B162] -> 93.52045 | C162: of:=VLOOKUP([.A162];[$gdp.A162:.B360];2) -> 5.65873
A163: of:=[$lit.A163] -> Yemen | B163: of:=[$lit.B163] -> 37.09 | C163: of:=VLOOKUP([.A163];[$gdp.A163:.B361];2) -> 5.14743
A164: of:=[$lit.A164] -> Zambia | B164: of:=[$lit.B164] -> 83.00767 | C164: of:=VLOOKUP([.A164];[$gdp.A164:.B362];2) -> 1.09972
A165: of:=[$lit.A165] -> Zimbabwe | B165: of:=[$lit.B165] -> 88.69342 | C165: of:=VLOOKUP([.A165];[$gdp.A165:.B363];2) -> 8.42933